{
  "schema_version": "1.0",
  "application_id": "app_demo_004",
  "application_revision": 1,
  "candidate_facts": [
    {
      "fact_id": "fact_001",
      "field": "patient.relationship_to_applicant",
      "value": {
        "kind": "text",
        "value": "母亲"
      },
      "source_type": "user_input",
      "evidence_ids": [],
      "verification_status": "pending",
      "user_confirmed": false
    },
    {
      "fact_id": "fact_002",
      "field": "treatment.estimated_cost",
      "value": {
        "kind": "money",
        "value": {
          "currency": "CNY",
          "amount_minor": 3000000
        }
      },
      "source_type": "document",
      "evidence_ids": [
        "ev_demo_001"
      ],
      "verification_status": "pending",
      "user_confirmed": false
    }
  ],
  "questions": [
    {
      "question_id": "question_001",
      "field": "patient.medical_summary",
      "question": "请简要说明您母亲的主要病情、诊断或目前的治疗情况。",
      "reason": "目前未提供患者的具体病情或诊断信息，便于后续整理和核实申请内容。",
      "required": false
    },
    {
      "question_id": "question_002",
      "field": "treatment.paid_cost",
      "question": "截至目前，您母亲已经支付了多少医疗费用？如有具体金额请说明。",
      "reason": "已支付费用有助于全面了解经济压力和筹款需求，目前未见相关信息。",
      "required": false
    }
  ],
  "warnings": []
}