{
  "schema_version": "1.0",
  "application_id": "app_demo_004",
  "application_revision": 1,
  "candidate_facts": [
    {
      "fact_id": "fact_001",
      "field": "patient.relationship_to_applicant",
      "value": {
        "kind": "text",
        "value": "母亲"
      },
      "source_type": "user_input",
      "evidence_ids": [],
      "verification_status": "pending",
      "user_confirmed": false
    },
    {
      "fact_id": "fact_002",
      "field": "treatment.estimated_cost",
      "value": {
        "kind": "money",
        "value": {
          "currency": "CNY",
          "amount_minor": 3000000
        }
      },
      "source_type": "document",
      "evidence_ids": [
        "ev_demo_001"
      ],
      "verification_status": "pending",
      "user_confirmed": false
    },
    {
      "fact_id": "fact_003",
      "field": "treatment.estimated_cost",
      "value": {
        "kind": "money",
        "value": {
          "currency": "CNY",
          "amount_minor": 5000000
        }
      },
      "source_type": "user_input",
      "evidence_ids": [],
      "verification_status": "pending",
      "user_confirmed": false
    }
  ],
  "questions": [
    {
      "question_id": "question_001",
      "field": "treatment.estimated_cost",
      "question": "您自述记得后续治疗预计费用为人民币五万元，但本次上传的费用预估单材料显示为三万元，请问以哪个为准？是否有更新的费用预估单？",
      "reason": "用户自述与材料中后续治疗预计费用金额不一致，需要确认实际金额或是否有更新材料。",
      "required": false
    }
  ],
  "warnings": [
    "用户自述后续治疗预计费用为五万元，材料《虚构费用预估单.pdf》显示为三万元，存在金额不一致。已分别提取两个候选事实，并在追问中提示用户核实。"
  ]
}