{
  "schema_version": "1.0",
  "application_id": "app_mdcc_eval_0031",
  "application_revision": 1,
  "candidate_facts": [
    {
      "fact_id": "fact_001",
      "field": "treatment.paid_cost",
      "value": {
        "kind": "money",
        "value": {
          "currency": "CNY",
          "amount_minor": 12345
        }
      },
      "source_type": "user_input",
      "evidence_ids": [],
      "verification_status": "pending",
      "user_confirmed": false
    },
    {
      "fact_id": "fact_002",
      "field": "treatment.estimated_cost",
      "value": {
        "kind": "money",
        "value": {
          "currency": "CNY",
          "amount_minor": 56789
        }
      },
      "source_type": "user_input",
      "evidence_ids": [],
      "verification_status": "pending",
      "user_confirmed": false
    }
  ],
  "questions": [],
  "warnings": [
    "本次输入未附材料，已支付医疗费与后续预估治疗费均来自用户自述，尚未经材料核实。",
    "用户自述中未提供患者与申请人的关系、病情诊断、治疗记录日期、当前所在城市等信息，本次未生成相应事实。"
  ]
}
