{
"schema_version": "1.0",
"application_id": "app_demo_003",
"application_revision": 1,
"candidate_facts": [
{
"fact_id": "fact_001",
"field": "patient.relationship_to_applicant",
"value": {
"kind": "text",
"value": "母亲"
},
"source_type": "user_input",
"evidence_ids": [],
"verification_status": "pending",
"user_confirmed": false
},
{
"fact_id": "fact_002",
"field": "patient.medical_summary",
"value": {
"kind": "text",
"value": "用户自述医生表示可能是肺部肿瘤，目前仍在检查，尚未确诊"
},
"source_type": "user_input",
"evidence_ids": [],
"verification_status": "pending",
"user_confirmed": false
},
{
"fact_id": "fact_003",
"field": "treatment.paid_cost",
"value": {
"kind": "money",
"value": {
"currency": "CNY",
"amount_minor": 2000000
}
},
"source_type": "user_input",
"evidence_ids": [],
"verification_status": "pending",
"user_confirmed": false
}
],
"questions": [
{
"question_id": "question_001",
"field": "treatment.estimated_cost",
"question": "您提到后续治疗费用不清楚，请问目前是否已有医院出具的费用预估单或医生对后续治疗费用的书面说明？如有，大致金额是多少？",
"reason": "后续预估治疗费是理解本次申请所需的关键信息；用户已表示不清楚，因此改为询问是否已有医院费用预估单，没有则保留未知。",
"required": false
},
{
"question_id": "question_002",
"field": "documents.diagnosis_proof",
"question": "本次未上传材料，请问后续是否可以补充诊断或检查相关材料（如检查报告、诊断证明等）？",
"reason": "补充诊断或检查材料便于核对已有陈述，但本次输入未附材料，不代表用户没有材料或医院尚未出具材料。",
"required": false
}
],
"warnings": [
"用户自述“医生说可能是肺部肿瘤，目前还在检查，没有确诊”，该信息为不确定性陈述，已按原意保留在 patient.medical_summary 中，未单独提取为确诊结论。",
"本次输入未附材料（extracted_documents 为空），仅说明本次输入未附材料，不代表用户没有材料、无法提供材料或医院尚未出具材料。",
"用户自述已支付人民币两万元医疗费，已按 20000 元换算为 2000000 分记录，仍需程序复核。",
"用户自述“后续治疗费用不清楚”，未生成 treatment.estimated_cost 事实，保留为未知。"
]
}